{
  "$schema":"https://json-schema.org/draft/2020-12/schema",
  "$id":"https://rules-residue.invalid/schemas/story-construction/text-order-v2.schema.json",
  "title":"Synthetic M0 DeepSeek Text Order v2",
  "type":"object","additionalProperties":false,
  "required":["schema_version","order_id","order_authority","owner_token","task_type","namespace_prefix","canon","release_eligible","promotion_allowed","disposition","synthetic_fixture_id","objective","route_ref","dossier_ref","canon_refs","reveal_refs","authorized_claims","forbidden_claims","context_manifest_ref","context_manifest_sha256","omission_report_ref","omission_report_sha256","intensity_contract_id","intensity_contract_revision","input_components","input_hash","workflow_stages","max_targeted_repairs","provider_profile_ref","provider_execution_authorized","requested_content_class","creates_authority","forbidden_capabilities","return_contract","order_hash"],
  "properties":{
    "schema_version":{"const":"2.0.0"},"order_id":{"type":"string","pattern":"^TEXT-ORDER-TEST-[A-Z0-9-]+$"},"order_authority":{"const":"VALIDATED_TEXT_ORDER_PACKAGE"},"owner_token":{"const":"deepseek_harness"},"task_type":{"const":"literary"},
    "namespace_prefix":{"const":"TEST-"},"canon":{"const":false},"release_eligible":{"const":false},"promotion_allowed":{"const":false},"disposition":{"const":"TEST_EVIDENCE_ONLY"},"synthetic_fixture_id":{"const":"TEST-SCG-M0-FIXTURE-001"},
    "objective":{"type":"string","minLength":1},"route_ref":{"type":"string","pattern":"^TEST-ROUTE-[A-Z0-9-]+$"},"dossier_ref":{"type":"string","pattern":"^TEST-[A-Z0-9-]+$"},"canon_refs":{"type":"array","minItems":1,"uniqueItems":true,"items":{"type":"string","pattern":"^TEST-[A-Z0-9-]+$"}},"reveal_refs":{"type":"array","minItems":1,"uniqueItems":true,"items":{"type":"string","pattern":"^TEST-[A-Z0-9-]+$"}},"authorized_claims":{"type":"array","minItems":1,"uniqueItems":true,"items":{"type":"string","minLength":1}},"forbidden_claims":{"type":"array","minItems":1,"uniqueItems":true,"items":{"type":"string","minLength":1}},
    "context_manifest_ref":{"type":"string","minLength":1},"context_manifest_sha256":{"type":"string","pattern":"^[0-9a-f]{64}$"},"omission_report_ref":{"type":"string","minLength":1},"omission_report_sha256":{"type":"string","pattern":"^[0-9a-f]{64}$"},
    "intensity_contract_id":{"type":"string","pattern":"^TEST-[A-Z0-9-]+$"},"intensity_contract_revision":{"type":"integer","minimum":1},
    "input_components":{"type":"object","additionalProperties":false,"required":["canon_slice_hash","dossier_hash","reveal_contract_hash","style_contract_hash","source_matrix_hash","context_manifest_hash","omission_report_hash"],"properties":{"canon_slice_hash":{"type":"string","pattern":"^[0-9a-f]{64}$"},"dossier_hash":{"type":"string","pattern":"^[0-9a-f]{64}$"},"reveal_contract_hash":{"type":"string","pattern":"^[0-9a-f]{64}$"},"style_contract_hash":{"type":"string","pattern":"^[0-9a-f]{64}$"},"source_matrix_hash":{"type":"string","pattern":"^[0-9a-f]{64}$"},"context_manifest_hash":{"type":"string","pattern":"^[0-9a-f]{64}$"},"omission_report_hash":{"type":"string","pattern":"^[0-9a-f]{64}$"}}},
    "input_hash":{"type":"string","pattern":"^[0-9a-f]{64}$"},"workflow_stages":{"type":"array","minItems":5,"uniqueItems":true,"items":{"enum":["COORDINATOR","SEMANTIC_IMPLEMENTER","LITERARY_WRITER","INDEPENDENT_CHECKER","DEFECT_ROUTER","TARGETED_REPAIR"]}},"max_targeted_repairs":{"const":2},
    "provider_profile_ref":{"const":"TEST-DEEPSEEK-HARNESS-PRECONTENT-M0-R1"},"provider_execution_authorized":{"const":false},"requested_content_class":{"enum":["P0","P1"]},"creates_authority":{"const":false},
    "forbidden_capabilities":{"type":"array","minItems":8,"uniqueItems":true,"items":{"enum":["CREATE_T1","CREATE_T2","CREATE_C1","MODIFY_AUTHORITY","WRITE_PERSISTENT_STATE","MODIFY_RUNTIME","MODIFY_LUA","MODIFY_GAME_PACKAGE"]}},
    "return_contract":{"type":"object","additionalProperties":false,"required":["semantic_draft","literary_draft","semantic_mapping","source_matrix","self_check","issues","version_usage","return_hashes","blocked_status","final_acceptance_allowed"],"properties":{"semantic_draft":{"const":true},"literary_draft":{"const":true},"semantic_mapping":{"const":true},"source_matrix":{"const":true},"self_check":{"const":true},"issues":{"const":true},"version_usage":{"const":true},"return_hashes":{"const":true},"blocked_status":{"const":"BLOCKED_NEEDS_CANON"},"final_acceptance_allowed":{"const":false}}},
    "order_hash":{"type":"string","pattern":"^[0-9a-f]{64}$"}
  }
}
