{
  "schema_version":"2.0.0","order_id":"TEXT-ORDER-TEST-SCG-M0-002","order_authority":"VALIDATED_TEXT_ORDER_PACKAGE","owner_token":"deepseek_harness","task_type":"literary",
  "namespace_prefix":"TEST-","canon":false,"release_eligible":false,"promotion_allowed":false,"disposition":"TEST_EVIDENCE_ONLY","synthetic_fixture_id":"TEST-SCG-M0-FIXTURE-001",
  "objective":"Produce a semantic and literary TEST candidate for the retreat route that respects the NPC epistemic boundary.",
  "route_ref":"TEST-ROUTE-RETREAT-SCG-M0-001","dossier_ref":"TEST-REGION-DOSSIER-SCG-M0-001","canon_refs":["TEST-T1-ANCHOR-PHASE-001","TEST-T2-SIGNAL-TO-MARK-001","TEST-ABSOLUTE-RULE-SCG-M0-001"],"reveal_refs":["TEST-C1-REVEAL-SCG-M0-001","TEST-NPC-OBSERVER-SCG-M0-001"],
  "authorized_claims":["The observer directly heard two signals.","Retreat before the second signal returns to the safe threshold."],"forbidden_claims":["Knowledge of TEST-HIDDEN-CAUSE-001.","Any formal world truth.","A worker-created Reveal."],
  "context_manifest_ref":"tests/fixtures/story-construction/precontent-m0/test-context-manifest-text-002.json","context_manifest_sha256":"5de32f11129e1a5198249878efc7249cfb95051204693de97f43e85d6ee07c89",
  "omission_report_ref":"tests/fixtures/story-construction/precontent-m0/test-omission-report-text-002.json","omission_report_sha256":"58f24a2fbff8262464b79b9e2e55e738ad8730fb4bfe62e43bfb3a5c5f493119",
  "intensity_contract_id":"TEST-REGION-INTENSITY-SCG-M0-001","intensity_contract_revision":1,
  "input_components":{"canon_slice_hash":"97acd8fcb772c043dc41b2cba5895d8ca30951b4cf04a25c48654045fabe5ace","dossier_hash":"16dc6e238a3ea26da49b67ebf1c85b84ee8299c0fb69ea8d6f17eddd1e6c20dc","reveal_contract_hash":"f524933e0d0902efb2d88ce3e31a19934484006b0bd20dbc40f0fff8065628e9","style_contract_hash":"e73fcea479e47155bab12cca1e717a68b6842ec43775ea4013831101b9b0fbaf","source_matrix_hash":"7319d3670ae280d4a32fc2e40aa8412faeb4dc465092b067e0147574734c7807","context_manifest_hash":"5de32f11129e1a5198249878efc7249cfb95051204693de97f43e85d6ee07c89","omission_report_hash":"58f24a2fbff8262464b79b9e2e55e738ad8730fb4bfe62e43bfb3a5c5f493119"},
  "input_hash":"f57871d20bf560942877d39bb2bcdaa9a26de80d34b3ad86ccc408696bfb0061","workflow_stages":["COORDINATOR","SEMANTIC_IMPLEMENTER","LITERARY_WRITER","INDEPENDENT_CHECKER","DEFECT_ROUTER","TARGETED_REPAIR"],"max_targeted_repairs":2,"provider_profile_ref":"TEST-DEEPSEEK-HARNESS-PRECONTENT-M0-R1","provider_execution_authorized":false,"requested_content_class":"P1","creates_authority":false,
  "forbidden_capabilities":["CREATE_T1","CREATE_T2","CREATE_C1","MODIFY_AUTHORITY","WRITE_PERSISTENT_STATE","MODIFY_RUNTIME","MODIFY_LUA","MODIFY_GAME_PACKAGE"],"return_contract":{"semantic_draft":true,"literary_draft":true,"semantic_mapping":true,"source_matrix":true,"self_check":true,"issues":true,"version_usage":true,"return_hashes":true,"blocked_status":"BLOCKED_NEEDS_CANON","final_acceptance_allowed":false},"order_hash":"263705e9d5eaa9b878af4b6506ebce7cf6b7d46cf5ef556c05fe575ba73fc4f1"
}
