{
  "schema_version":"2.0.0","order_id":"TEXT-ORDER-TEST-SCG-M0-001","order_authority":"VALIDATED_TEXT_ORDER_PACKAGE","owner_token":"deepseek_harness","task_type":"literary",
  "namespace_prefix":"TEST-","canon":false,"release_eligible":false,"promotion_allowed":false,"disposition":"TEST_EVIDENCE_ONLY","synthetic_fixture_id":"TEST-SCG-M0-FIXTURE-001",
  "objective":"Produce a semantic and literary TEST candidate for the normal route without explaining the hidden cause.",
  "route_ref":"TEST-ROUTE-NORMAL-SCG-M0-001","dossier_ref":"TEST-REGION-DOSSIER-SCG-M0-001","canon_refs":["TEST-T1-ANCHOR-PHASE-001","TEST-T2-SIGNAL-TO-MARK-001","TEST-ABSOLUTE-RULE-SCG-M0-001"],"reveal_refs":["TEST-C1-REVEAL-SCG-M0-001"],
  "authorized_claims":["The first signal precedes the second.","A visible mark follows a crossing after the second signal."],"forbidden_claims":["The hidden cause.","Any formal world truth.","A puzzle answer."],
  "context_manifest_ref":"tests/fixtures/story-construction/precontent-m0/test-context-manifest-text-001.json","context_manifest_sha256":"33d572bd195415fcef7204e986f2a858573ffcca6065d77f2a33d420e8287000",
  "omission_report_ref":"tests/fixtures/story-construction/precontent-m0/test-omission-report-text-001.json","omission_report_sha256":"d96a366572864708178c3d204aa7a3259f19b090c65594da7a83463f6f6231ed",
  "intensity_contract_id":"TEST-REGION-INTENSITY-SCG-M0-001","intensity_contract_revision":1,
  "input_components":{"canon_slice_hash":"97acd8fcb772c043dc41b2cba5895d8ca30951b4cf04a25c48654045fabe5ace","dossier_hash":"16dc6e238a3ea26da49b67ebf1c85b84ee8299c0fb69ea8d6f17eddd1e6c20dc","reveal_contract_hash":"f524933e0d0902efb2d88ce3e31a19934484006b0bd20dbc40f0fff8065628e9","style_contract_hash":"e73fcea479e47155bab12cca1e717a68b6842ec43775ea4013831101b9b0fbaf","source_matrix_hash":"7319d3670ae280d4a32fc2e40aa8412faeb4dc465092b067e0147574734c7807","context_manifest_hash":"33d572bd195415fcef7204e986f2a858573ffcca6065d77f2a33d420e8287000","omission_report_hash":"d96a366572864708178c3d204aa7a3259f19b090c65594da7a83463f6f6231ed"},
  "input_hash":"dcdba0eceec6bf0f1a0269d790fce117a55f4f6ea494b7b98308bc0a612df885","workflow_stages":["COORDINATOR","SEMANTIC_IMPLEMENTER","LITERARY_WRITER","INDEPENDENT_CHECKER","DEFECT_ROUTER","TARGETED_REPAIR"],"max_targeted_repairs":2,"provider_profile_ref":"TEST-DEEPSEEK-HARNESS-PRECONTENT-M0-R1","provider_execution_authorized":false,"requested_content_class":"P1","creates_authority":false,
  "forbidden_capabilities":["CREATE_T1","CREATE_T2","CREATE_C1","MODIFY_AUTHORITY","WRITE_PERSISTENT_STATE","MODIFY_RUNTIME","MODIFY_LUA","MODIFY_GAME_PACKAGE"],"return_contract":{"semantic_draft":true,"literary_draft":true,"semantic_mapping":true,"source_matrix":true,"self_check":true,"issues":true,"version_usage":true,"return_hashes":true,"blocked_status":"BLOCKED_NEEDS_CANON","final_acceptance_allowed":false},"order_hash":"2ff0a2f97a2571aedc5f417c2ed5386542281a18be44835cfc9176a8e53c5bea"
}
